{
  "citation": {
    "date": [
      {
        "date": "2023-08-18 07:57:13",
        "dateType": "revision"
      }
    ],
    "description": "No description available.",
    "title": "Global Change Master Directory (GCMD) Disciplines",
    "edition": "Version 16.8",
    "onlineResource": [
      {
        "uri": "https://gcmd.earthdata.nasa.gov/kms/concept/5b98265f-7cd1-4976-bc78-1ac1e6b9b90f?format=json}"
      }
    ],
    "identifier": [
      {
        "identifier": "5b98265f-7cd1-4976-bc78-1ac1e6b9b90f"
      }
    ]
  },
  "keywordType": "discipline",
  "label": "Disciplines",
  "keywords": []
}